key,name,course_link,level,summary,required_knowledge,
ud837,Android Development for Beginners,https://www.udacity.com/course/android-development-for-beginners--ud837?utm_medium=referral&utm_campaign=api,beginner,"To access the free version of this course, click the blue button that says <em>Access Course Materials.</em>

Learn the basics of Android and Java programming, and take the first step on your journey to becoming an Android developer! 

This course is designed for students who are new to programming, and want to learn how to build Android apps. You don’t need any programming experience to take this course. If you’ve been using a smartphone to surf the web and chat with friends, then you’re our perfect target student! 

Learning anything new can be tough. We will walk you through the process of making Android apps, but to get the most out of this course, you must bring your enthusiasm for learning, and budget time on your calendar to learn with us.

By the end of the course, you’ll build two simple (but powerful) apps that you can share with your friends. We also hope that you will learn enough through this course to decide how best to continue your journey as an Android app developer, if you're interesting in pursuing such a path.","If you are new to programming and don’t know where to start, then this is the course for you! 

We will use Android Studio to build our apps, so you should have access to a computer that can run Android Studio in order to follow along (see Android Studio's <a href=""https://developer.android.com/sdk/index.html#Requirements"" target=""_blank"">System Requirements</a> for details). Don’t worry, **you do not need to install Android Studio in advance** -- we will provide detailed installation instructions as part of the course. 

Access to an Android device is helpful, but not at all required.

Now, in case you have some programming experience, parts of this course may be too slow for you — you should feel free to skip those sections.

Finally, the **most important prerequisite** is a willingness to learn new things, and belief that you can do this!",
ud802,How to create <anything> in Android,https://www.udacity.com/course/how-to-create-anything-in-android--ud802?utm_medium=referral&utm_campaign=api,beginner,"Here is one important question Android developers ask while making apps: <i>""How can I do &#95;&#95;&#95;&#95;&#95;&#95;&#95;&#95; in Android?""</i>

The following are versions of this question that we came across recently:

 - How can I add radio buttons to my app?
 -  How can I play a sound?
 - How can I navigate between multiple screens? 

This course is a collection of such questions and their answers. 

By the end of this course you will have mastered the ability to implement new Android features by reading a blog or article — this is a critical skill possessed by professional Android developers. As a result, you will also be able to use several User Interface components — like Toggle Buttons, Menus, Grid View and many more —  that are central to making functional and delightful Android apps.","You will need to know the very basics of Android programming (Java) to be successful in this course. If you are completely new to programming, you should take <a href=""https://www.udacity.com/course/android-development-for-beginners--ud837"" target=""_blank"">Android Development For Beginners</a> before enrolling in this course.

We will use Android Studio to build our apps, so you should have access to a computer that can run Android Studio in order to follow along (see Android Studio's <a href=""https://developer.android.com/sdk/index.html#Requirements"" target=""_blank"">System Requirements</a> for details). 

Access to an Android device is helpful, but not at all required.

Finally, the most important prerequisite is a willingness to learn new things, and belief that you can do this!",
ud853,Developing Android Apps,https://www.udacity.com/course/developing-android-apps--ud853?utm_medium=referral&utm_campaign=api,intermediate,"As the first course in the <a href=""https://www.udacity.com/course/nd801"" target=""_blank"">Android Developer Nanodegree</a>,  Developing Android Apps is the foundation of our advanced Android curriculum. This course blends theory and practice to help you build great apps the right way. In this course, you'll work with instructors step-by-step to build a cloud-connected Android app, and learn best practices of mobile development, and Android development in particular.

####[Download Udacity's Android app](https://play.google.com/store/apps/details?id=com.udacity.android) to keep learning wherever you go!","**This course is intended for students with at least 1 year of programming experience in Java or another object-oriented programming language** (for example: C++, Objective C or Python). 

If you are new to programming, we recommend taking <a href=""http://www.udacity.com/course/ud837"" target=""_blank"">Android for Beginners</a>, which we created with Google for students just like you!

Also, Udacity's <a href=""http://www.udacity.com/course/cs046"" target=""_blank"">Intro to Java</a> is a helpful background if you're looking to refresh your Java skills.

You will be expected to download <a href=""http://developer.android.com/sdk/installing/studio.html"" target=""_blank"">Android Studio</a> in order to follow along with the instructors throughout the course. For guidance on the install process, take our <a href=""http://www.udacity.com/course/ud808"" target=""_blank"">How to Install Android Studio</a> mini-course.

In addition, you should be comfortable working with code on <a href=""http://www.github.com"" target=""_blank"">GitHub</a>. 

Access to an Android device is helpful -- but not required -- to complete the final project.",
ud855,Advanced Android App Development,https://www.udacity.com/course/advanced-android-app-development--ud855?utm_medium=referral&utm_campaign=api,advanced,"This course will guide you through the process of productionizing an app, using Sunshine, the weather app we built in <a href=""https://www.udacity.com/course/ud853"" target=""_blank"">Developing Android Apps</a>. Following Android's <a href=""http://developer.android.com/distribute/essentials/quality/core.html"" target=""_blank"">Core App Quality Guidelines</a>, we'll identify the production criteria that still needs to be implemented, then tackle each problem until Sunshine is ready to publish on the Google Play Store. In the process, we'll introduce you to a host of tools and concepts, including: material design approaches, image-handling, performance profiling, and more!","To get the most out of this course, you should have at least 1-2 years of Java experience, and prior experience developing Android apps. If you lack experience in Android development, please take this course's predecessor, <a href=""https://www.udacity.com/course/ud853"" target=""_blank"">Developing Android Apps</a> prior to enrolling in this one. 

Access to an Android device is helpful, but you may use an emulator if you prefer.

We will share code for this course on Github, so you must be familiar with using Github to complete the activities and final project. Take our course on <a href=""https://www.udacity.com/course/how-to-use-git-and-github--ud775"" target=""_blank"">Using Git and Github</a> if you lack this background.",
ud867,Gradle for Android and Java,https://www.udacity.com/course/gradle-for-android-and-java--ud867?utm_medium=referral&utm_campaign=api,advanced,"This course explores how the Gradle build tool compiles and packages apps, and you'll learn to customize the build process. The first half of this course is for anyone interested in Gradle, build automation, and continuous delivery of software.

The latter half of the course reveals the magic that happens after you hit the ""Run"" button in Android Studio. You'll also explore advanced Android topics, learning to configure free vs paid app flavors, create and integrate Android libraries, test your app, and prepare your app for the Play Store.","**This is an advanced course aimed at students with experience developing Android or Java apps.**

 If you lack this experience, please take <a href=""https://www.udacity.com/course/ud853"" target=""_blank"">Developing Android Apps</a> and <a href=""https://www.udacity.com/course/ud855"" target=""_blank"">Advanced Android App Development</a> prior to taking this course.

* To follow along with course activities, you **must** have access to the latest release of <a href=""https://developer.android.com/sdk/index.html"" target=""_blank"">Android Studio</a>
* You should have access to an Android device for running and testing your apps.  
* You should also be familiar with Github. Take our course on <a href=""https://www.udacity.com/course/how-to-use-git-and-github--ud775"" target=""_blank"">Using Git and Github</a> if you lack this background.",
ud876-1,Google Play Services: Location & Context,https://www.udacity.com/course/google-play-services-location-context--ud876-1?utm_medium=referral&utm_campaign=api,intermediate,"Vitally important for building the best possible mobile app, the Location and Context API allows your Android app behavior to change based on location. 

In this course, you’ll learn how to implement this with the Fused Location Provider, which gives you much more than simple GPS. You’ll also learn about Activity recognition, which allows you to tailor your app to what the user is doing. Finally, you’ll learn about Geofencing, and how location services work alongside geofences to allow you to build apps that could be used for augmented reality!

**This course is part of the Google Play Services series, which features a  variety of different Google APIs. Designed as standalone short courses, you can take any course on its own, or take them all!**

* **Google Play Services: Location and Context** [this course] 
* <a href=""http://www.udacity.com/course/ud876-2"" target=""_blank"">Google Play Services: Analytics</a>
* <a href=""http://www.udacity.com/course/ud876-3"" target=""_blank"">Google Play Services: AdMob</a> 
* <a href=""http://www.udacity.com/course/ud876-4"" target=""_blank"">Google Play Services: Maps</a> 
* <a href=""http://www.udacity.com/course/ud876-5"" target=""_blank"">Google Play Services: Identity</a>","To get the most out of this course, you should have prior experience developing Android apps. If you lack this experience, please take <a href=""https://www.udacity.com/course/ud853"" target=""_blank"">Developing Android Apps</a> prior to enrolling in this one. We also recommend taking <a href=""https://www.udacity.com/course/ud855"" target=""_blank"">Advanced Android App Development</a> if you are interested in publishing your app to the Google Play Store.

To follow along with course activities, you **must** have access to the latest release of <a href=""https://developer.android.com/sdk/index.html"" target=""_blank"">Android Studio</a>, which includes an emulator that you can use for basic testing of your apps. For the best experience, you should use a recent Android device

We share code through GitHub, so you must be familiar with using GitHub to access code. Take our course on <a href=""https://www.udacity.com/course/how-to-use-git-and-github--ud775"" target=""_blank"">Using Git and GitHub</a> if you lack this background.",
ud876-2,Google Play Services: Analytics,https://www.udacity.com/course/google-play-services-analytics--ud876-2?utm_medium=referral&utm_campaign=api,intermediate,"Where in the world are people using your app? Which activities do they use most? How do they navigate through your app? Take this course to learn how to add code to your mobile app to send usage data to Google Analytics, and get answers to questions like these.

This course also covers how to use Google Tag Manager to send updated information to your app without needing to redeploy the APK, and to manage all your Google Analytics tags.

**This course is part of the Google Play Services series, which features a  variety of different Google APIs. Designed as standalone short courses, you can take any course on its own, or take them all!**


* <a href=""http://www.udacity.com/course/ud876-1"" target=""_blank"">Google Play Services: Location and Context</a> 
* **Google Play Services: Analytics** [this course]
* <a href=""http://www.udacity.com/course/ud876-3"" target=""_blank"">Google Play Services: AdMob</a> 
* <a href=""http://www.udacity.com/course/ud876-4"" target=""_blank"">Google Play Services: Maps</a> 
* <a href=""http://www.udacity.com/course/ud876-5"" target=""_blank"">Google Play Services: Identity</a>","To get the most out of this course, you should have prior experience developing Android apps. If you lack this experience, please take <a href=""https://www.udacity.com/course/ud853"" target=""_blank"">Developing Android Apps</a> prior to enrolling in this one. We also recommend taking <a href=""https://www.udacity.com/course/ud855"" target=""_blank"">Advanced Android App Development</a> if you are interested in publishing your app to the Google Play Store.

To follow along with course activities, you **must** have access to the latest release of <a href=""https://developer.android.com/sdk/index.html"" target=""_blank"">Android Studio</a>, which includes an emulator that you can use for basic testing of your apps. For the best experience, you should use a recent Android device

We share code through GitHub, so you must be familiar with using GitHub to access code. Take our course on <a href=""https://www.udacity.com/course/how-to-use-git-and-github--ud775"" target=""_blank"">Using Git and GitHub</a> if you lack this background.",
ud876-3,Google Play Services: AdMob,https://www.udacity.com/course/google-play-services-admob--ud876-3?utm_medium=referral&utm_campaign=api,intermediate,"In this course, you will learn how to monetize apps using Google's AdMob to display banner and interstitial ads.

**This course is part of the Google Play Services series, which features a  variety of different Google APIs. Designed as standalone short courses, you can take any course on its own, or take them all!**

* <a href=""http://www.udacity.com/course/ud876-1"" target=""_blank"">Google Play Services: Location and Context</a> 
* <a href=""http://www.udacity.com/course/ud876-2"" target=""_blank"">Google Play Services: Analytics</a> 
* **Google Play Services: AdMob** [this course]
* <a href=""http://www.udacity.com/course/ud876-4"" target=""_blank"">Google Play Services: Maps</a> 
* <a href=""http://www.udacity.com/course/ud876-5"" target=""_blank"">Google Play Services: Identity</a>","To get the most out of this course, you should have prior experience developing Android apps. If you lack this experience, please take <a href=""https://www.udacity.com/course/ud853"" target=""_blank"">Developing Android Apps</a> prior to enrolling in this one. We also recommend taking <a href=""https://www.udacity.com/course/ud855"" target=""_blank"">Advanced Android App Development</a> if you are interested in publishing your app to the Google Play Store.

To follow along with course activities, you **must** have access to the latest release of <a href=""https://developer.android.com/sdk/index.html"" target=""_blank"">Android Studio</a>, which includes an emulator that you can use for basic testing of your apps. For the best experience, you should use a recent Android device.",
ud876-4,Google Play Services: Maps,https://www.udacity.com/course/google-play-services-maps--ud876-4?utm_medium=referral&utm_campaign=api,intermediate,"In this course, you’ll learn everything from how to add maps to your Android app, to how to build a virtual hike down the Grand Canyon!

**This course is part of the Google Play Services series, which features a  variety of different Google APIs. Designed as standalone short courses, you can take any course on its own, or take them all!**

* <a href=""http://www.udacity.com/course/ud876-1"" target=""_blank"">Google Play Services: Location and Context</a> 
* <a href=""http://www.udacity.com/course/ud876-2"" target=""_blank"">Google Play Services: Analytics</a>
* <a href=""http://www.udacity.com/course/ud876-3"" target=""_blank"">Google Play Services: AdMob</a> 
* **Google Play Services: Maps** [this course]
* <a href=""http://www.udacity.com/course/ud876-5"" target=""_blank"">Google Play Services: Identity</a>","To get the most out of this course, you should have prior experience developing Android apps. If you lack this experience, please take <a href=""https://www.udacity.com/course/ud853"" target=""_blank"">Developing Android Apps</a> prior to enrolling in this one. We also recommend taking <a href=""https://www.udacity.com/course/ud855"" target=""_blank"">Advanced Android App Development</a> if you are interested in publishing your app to the Google Play Store.

To follow along with course activities, you **must** have access to the latest release of <a href=""https://developer.android.com/sdk/index.html"" target=""_blank"">Android Studio</a>, which includes an emulator that you can use for basic testing of your apps. For the best experience, you should use a recent Android device

We share code through GitHub, so you must be familiar with using GitHub to access code. Take our course on <a href=""https://www.udacity.com/course/how-to-use-git-and-github--ud775"" target=""_blank"">Using Git and GitHub</a> if you lack this background.",
ud876-5,Google Play Services: Identity,https://www.udacity.com/course/google-play-services-identity--ud876-5?utm_medium=referral&utm_campaign=api,intermediate,"In this course, you'll learn how to use Google’s Identity Platform to allow users to sign-in using their Google credentials, and how to access data that they grant you permission to access. 

**This course is part of the Google Play Services series, which features a  variety of different Google APIs. Designed as standalone short courses, you can take any course on its own, or take them all!**

* <a href=""https://www.udacity.com/course/google-play-services-location-context--ud876-1"" target=""_blank"">Google Play Services: Location and Context</a>
* <a href=""https://www.udacity.com/course/google-play-services-analytics--ud876-2"" target=""_blank"">Google Play Services: Analytics</a>
* <a href=""https://www.udacity.com/course/google-play-services-admob--ud876-3"" target=""_blank"">Google Play Services: AdMob</a> 
* <a href=""https://www.udacity.com/course/google-play-services-maps--ud876-4"" target=""_blank"">Google Play Services: Maps</a> 
* **Google Play Services: Identity** [this course]","To get the most out of this course, you should have prior experience developing Android apps. If you lack this experience, please take <a href=""https://www.udacity.com/course/developing-android-apps--ud853"" target=""_blank"">Developing Android Apps</a> prior to enrolling in this one. We also recommend taking <a href=""https://www.udacity.com/course/advanced-android-app-development--ud855"" target=""_blank"">Advanced Android App Development</a> if you are interested in publishing your app to the Google Play Store.

To follow along with course activities, you **must** have access to the latest release of <a href=""https://developer.android.com/sdk/index.html"" target=""_blank"">Android Studio</a>, which includes an emulator that you can use for basic testing of your apps. For the best experience, you should use a recent Android device.

We share code through GitHub, so you must be familiar with using GitHub to access code. Take our course on <a href=""https://www.udacity.com/course/how-to-use-git-and-github--ud775"" target=""_blank"">Using Git and GitHub</a> if you lack this background.",
ud825,Android Performance,https://www.udacity.com/course/android-performance--ud825?utm_medium=referral&utm_campaign=api,advanced,"If you’ve ever hit performance issues that affect your app’s usability, this course will teach you how to identify and diagnose your performance problems. By the end of this course, you’ll be able to perform exploratory tests, run profiling tools, use outputs to navigate to problematic code, and design a plan of attack to mitigate poor performance. You’ll also gain a higher level of understanding about how program code and the Android platform interact, which will help you optimize for performance in the future.","To get the most from this course, you should have experience developing apps in Java on Android devices, understand the basics of the Android life cycle, and know how to perform basic operations in a terminal.    

You also need access to an Android device, and working knowledge of Github, in order to follow along with the exercises. 

If you’ve never developed a working Android app, check out our <a href=""http://www.udacity.com/course/ud853"" target=""_blank"">Developing Android Apps</a> course before taking this one.

If you're unfamiliar with Github, check out our course on <a href=""http://www.udacity.com/course/ud775"" target=""_blank"">How to Use Git and Github</a>.",
ud862,Material Design for Android Developers,https://www.udacity.com/course/material-design-for-android-developers--ud862?utm_medium=referral&utm_campaign=api,intermediate,"In this course, you'll learn how to apply the material design principles that define Android's visual language to your apps. We'll start by walking you through Android design fundamentals, then we'll show you how to apply this knowledge to transform design elements of sample apps. By the end of the course, you'll understand how to create and use material design elements, surfaces, transitions and graphics in your app, across multiple form factors.","To get the most out of this course, you should have prior experience developing Android apps. If you lack this experience, please take <a href=""https://www.udacity.com/course/ud853"" target=""_blank"">Developing Android Apps</a> prior to enrolling in this one. We also recommend taking <a href=""https://www.udacity.com/course/ud855"" target=""_blank"">Advanced Android App Development</a> if you are interested in publishing your app to the Google Play Store.

To follow along with course activities, you **must** have access to the latest release of <a href=""https://developer.android.com/sdk/index.html"" target=""_blank"">Android Studio</a>, and should have access to an Android device for running and testing your apps.  

We share code through Github, so you must be familiar with using Github to access code. Take our course on <a href=""https://www.udacity.com/course/how-to-use-git-and-github--ud775"" target=""_blank"">Using Git and Github</a> if you lack this background.",
ud875A,Android Wear Development,https://www.udacity.com/course/android-wear-development--ud875A?utm_medium=referral&utm_campaign=api,advanced,"Extending your app to Android Wear smart watches allows you to reach your users wherever and whenever they'd want or need your app. As you'll learn in this course, you can take your existing Android development experience and apply it to developing for Android Wear. This course will take you through getting started, application structure, and information sharing between the wearable and the companion phone or the cloud. We'll also give you the knowledge necessary for designing great user experiences for wearables including how to take advantage of the always-on display of Android Wear devices.

This course is part of the Ubiquitous Computing series. Designed as standalone short courses, you can take any course on its own, or take them all!

* **Android Wear Development** [this course]
* <a href=""https://www.udacity.com/course/android-tv-and-google-cast-development--ud875B"" target=""_blank"">Android TV and Google Cast Development</a>
* <a href=""https://www.udacity.com/course/android-auto-development--ud875C"" target=""_blank"">Android Auto Development</a>","To get the most out of this course, you should have prior experience developing Android apps. If you lack this experience, please take <a href=""https://www.udacity.com/course/ud853"" target=""_blank"">Developing Android Apps</a> prior to enrolling in this one.

To follow along with course activities, you **must** have access to the latest release of <a href=""https://developer.android.com/sdk/index.html"" target=""_blank"">Android Studio</a>.  

We share code through Github, so you must be familiar with using Github to access code. Take our course on <a href=""https://www.udacity.com/course/how-to-use-git-and-github--ud775"" target=""_blank"">Using Git and Github</a> if you lack this background.",
