key,name,course_link,level,summary,required_knowledge,
ud875B,Android TV and Google Cast Development,https://www.udacity.com/course/android-tv-and-google-cast-development--ud875B?utm_medium=referral&utm_campaign=api,advanced,"Go where your users are: the living room! With Google Cast and Android TV, you can add a big screen and cinematic experience to your app. This course shows you how to extend your existing Android app to work on Android TV and Google Cast. You can take advantage of both technologies without having to rewrite your app.

This course is part of the Ubiquitous Computing series. Designed as standalone short courses, you can take any course on its own, or take them all!

* <a href=""https://www.udacity.com/course/android-wear-development--ud875A"" target=""_blank"">Android Wear Development</a>
* **Android TV and Google Cast Development** [this course]
* <a href=""https://www.udacity.com/course/android-auto-development--ud875C"" target=""_blank"">Android Auto Development</a>","To get the most out of this course, you should have prior experience developing Android apps. If you lack this experience, please take <a href=""https://www.udacity.com/course/ud853"" target=""_blank"">Developing Android Apps</a> prior to enrolling in this one.

To follow along with course activities, you **must** have access to the latest release of <a href=""https://developer.android.com/sdk/index.html"" target=""_blank"">Android Studio</a>.  

We share code through Github, so you must be familiar with using Github to access code. Take our course on <a href=""https://www.udacity.com/course/how-to-use-git-and-github--ud775"" target=""_blank"">Using Git and Github</a> if you lack this background.",
ud875C,Android Auto Development,https://www.udacity.com/course/android-auto-development--ud875C?utm_medium=referral&utm_campaign=api,advanced,"Reach your users while they're out and about by extending your Media or Messaging app to Android Auto! As you'll learn in this course, making your app available in the car is as easy as extending your existing code. This course explains how to get started and then covers Media and Messaging apps in detail.

This course is part of the Ubiquitous Computing series. Designed as standalone short courses, you can take any course on its own, or take them all!

* <a href=""https://www.udacity.com/course/android-wear-development--ud875A"" target=""_blank"">Android Wear Development</a>
* <a href=""https://www.udacity.com/course/android-tv-and-google-cast-development--ud875B"" target=""_blank"">Android TV and Google Cast Development</a>
* **Android Auto Development** [this course]","To get the most out of this course, you should have prior experience developing Android apps. If you lack this experience, please take <a href=""https://www.udacity.com/course/ud853"" target=""_blank"">Developing Android Apps</a> prior to enrolling in this one. We also recommend taking <a href=""https://www.udacity.com/course/ud855"" target=""_blank"">Advanced Android App Development</a> and <a href=""https://www.udacity.com/course/ud876"" target=""_blank"">Google Play services</a>.

To follow along with course activities, you **must** have access to the latest release of <a href=""https://developer.android.com/sdk/index.html"" target=""_blank"">Android Studio</a>.  

We share code through Github, so you must be familiar with using Github to access code. Take our course on <a href=""https://www.udacity.com/course/how-to-use-git-and-github--ud775"" target=""_blank"">Using Git and Github</a> if you lack this background.",
ud509,Product Design,https://www.udacity.com/course/product-design--ud509?utm_medium=referral&utm_campaign=api,intermediate,"There is nothing more powerful than an idea whose time has come. This course is designed to help you materialize your game-changing idea and transform it into a product that you can build a business around. Product Design blends theory and practice to teach you product validation, UI/UX practices, Google’s Design Sprint and the process for setting and tracking actionable metrics.",This course has no formal prerequisites. You just need to have a problem to solve and be open to feedback!,
ud518,App Monetization,https://www.udacity.com/course/app-monetization--ud518?utm_medium=referral&utm_campaign=api,intermediate,"There is no higher form of user validation than having customers support your product with their wallets. However, the path to a profitable business is not necessarily an easy one. This course blends instruction with real life examples to help you effectively develop, implement, and measure your monetization strategy, iterating on the model as appropriate.","This course has no formal prerequisites, but you will get a lot more out of the instruction and exercises if you’ve got a product design, or you’ve completed <a href=""https://www.udacity.com/course/product-design--ud509"" target=""_blank"">Product Design</a>  before enrolling in this course.",
ud611,Intro to DevOps,https://www.udacity.com/course/intro-to-devops--ud611?utm_medium=referral&utm_campaign=api,advanced,"The goal of this course is to take existing IT professionals, whether they come from software development or operations, and help them appreciate the challenges facing companies who are looking to embrace scalable software deployment as well as the architectures and thought processes they can use to address these challenges. 

Students will start with a presentation of the problem as it stands today, then dive into the DevOps workflow and a survey of the system architectures currently being used to address this problem.","- Ability to install software
- Ability to use git
- Some experience with programming (even just scripting in shell)
- Some experience as SysAdmin; some experience with Linux is beneficial",
ud304,Intro to HTML and CSS,https://www.udacity.com/course/intro-to-html-and-css--ud304?utm_medium=referral&utm_campaign=api,beginner,"HTML and CSS are markup languages and the building blocks that make up the web. This course is called ""Not your Typical Intro"" because it does not follow the usual pattern of other courses and tutorials that you find on the Internet. Usually HTML and CSS are taught with a focus on language syntax. But knowing syntax alone does not enable you to create a webpage from a design. You need to know where to start and how to approach the task, in other words - you need to learn how to think like a front-end developer. 

In this course you will learn how to convert digital design mockups into static web pages. We will teach you how to approach page layout, how to break down a design mockup into page elements, and how to implement that in HTML and CSS.

You will also learn about responsive design techniques, which are increasingly important in a world where mobile devices and TV screens are used more and more often to look for information and entertainment.","You should have ability and skills to download and use a text editor for editing your web pages, we recommend <a href=""http://www.sublimetext.com/"" target=""_blank"">Sublime Text</a> or <a href=""https://atom.io/"" target=""_blank"">Atom</a>. You can use another text editor if you want, but it should have the ability to highlight code syntax for your own convenience.

You should be able to download and install <a href=""https://www.google.com/intl/en/chrome/browser/"" target=""_blank"">Google Chrome</a>, which is the browser we’ll be exploring developer tools with in this course.",
cs101,Intro to Computer Science,https://www.udacity.com/course/intro-to-computer-science--cs101?utm_medium=referral&utm_campaign=api,beginner,"In this introduction to computer programming course, you’ll learn and practice key computer science concepts by building your own versions of popular web applications. You’ll learn Python, a powerful, easy-to-learn, and widely used programming language, and you’ll explore computer science basics, as you build your own search engine and social network.",There is no prior computer programming knowledge needed for this course. Beginners are welcome!,
ud804,JavaScript Basics,https://www.udacity.com/course/javascript-basics--ud804?utm_medium=referral&utm_campaign=api,beginner,"We're here to help you get you started with JavaScript!
In the twenty plus years since its inception, JavaScript has become the _lingua franca_ of the web, that's to say, it's become the main tool to create interactive content on the Internet.

In this course, you'll explore the JavaScript programming language by creating an interactive version of your résumé. You’ll learn the JavaScript programming fundamentals you need while building new elements and sections to enhance your résumé.

This course is also a part of our <a href=""https://www.udacity.com/course/nd001"">Front-End Web Developer</a> Nanodegree.","We expect that you have *some* experience programming in another language, such as Python, and can describe concepts like loops, functions and objects. Our 
<a href=""https://www.udacity.com/course/cs101"" target=""_blank"">Intro to Computer Science</a>
 and <a href=""https://www.udacity.com/course/ud036"" target=""_blank"">Programming Fundamentals with Python</a> courses are great places to get started.

While we do describe the underlying principles behind basic programming techniques, this course focuses on implementing the principles with JavaScript rather than the principles themselves.

HTML and CSS are not required, however, knowledge of CSS will help you customize your résumé project.",
ud595,Linux Command Line Basics,https://www.udacity.com/course/linux-command-line-basics--ud595?utm_medium=referral&utm_campaign=api,beginner,"We have built this course for beginners who have no experience with the Linux system and the command-line interface.

In this course, you'll learn the basics of the command line interface of a Linux server: the terminal and shell (GNU Bash). This course includes an introduction to files and directories in the Linux filesystem.","To take this course, you should have beginner-level experience in a programming languages such as Python or JavaScript. While this course does not involve doing any programming, it does use concepts that are familiar to the beginning programmer such as ""function"", ""expression"", and ""string"".

*Note: This course is intended for beginners to the shell environment. If you have done shell scripting or other extensive use of the shell before, this course will probably be too introductory for you. You might want to check out our <a href=""http://www.udacity.com/ud299"" target=""_blank"">Configuring Linux Web Servers</a> course.*

---",
ud775,How to Use Git and GitHub,https://www.udacity.com/course/how-to-use-git-and-github--ud775?utm_medium=referral&utm_campaign=api,beginner,"Effective use of version control is an important and useful skill for any developer working on long-lived (or even medium-lived) projects, especially if more than one developer is involved. This course, *built with input from GitHub*, will introduce the basics of using version control by focusing on a particular version control system called Git and a collaboration platform called GitHub.

This course is part of the  <a href=""https://www.udacity.com/course/nd001"" target=""_blank"">Front End</a> and  <a href=""https://www.udacity.com/course/nd004"" target=""_blank"">Full Stack Nanodegrees</a>..","While this course does not involve programming, students should have some experience with a programming or markup language.
Additionally, students should be familiar with navigating the command line. If unfamiliar or if you want a refresher, check out [these instructions](https://www.udacity.com/wiki/ud775/command-line-instructions) or [this introductory course](https://udacity.com/course/ud595).",
ud036,Programming Foundations with Python,https://www.udacity.com/course/programming-foundations-with-python--ud036?utm_medium=referral&utm_campaign=api,beginner,"In this introductory programming class, you’ll learn Object-Oriented Programming, a must-have technique for software engineers that will allow you to reuse and share code easily. You’ll learn by doing, and will build byte-sized (ha!) mini projects in each lesson to learn and practice programming concepts. 

We’ve heard that programming can be intimidating for newcomers, and we’ve created this course to make sure that you have a great learning experience! You’ll learn ***actively*** with our mini projects (see the awesome list below), which you’ll be able to share proudly with your friends. You’ll also learn important programming concepts one by one, with no surprises or leaps of logic along the way. 

You’ll pick up some great tools for your programming toolkit in this course! You will: 

- Start coding in the programming language Python;
- Reuse and share code with Object-Oriented Programming;
- Create and share amazing, life-hacking projects!   


This introductory course is for you if you want to be a software engineer, or if you want to collaborate with programmers. Mastering Object-Oriented Programming will propel your career in tech forward, and it’s also a great way to learn how software engineers think about solving problems.

This course is also a part of our <a href=""https://www.udacity.com/course/nd004"" target=""_blank"">Full Stack Web Developer</a> Nanodegree.","We require some familiarity with the following programming ideas in any computer language (C++, Java, Python, English etc.):

- if statements
- loops
- functions


Don’t worry if you feel you need a refresher on any of these programming ideas. That’s ok. We will provide information that will remind you how to use these ideas when building programs.",
ud585,Intro to iOS App Development with Swift,https://www.udacity.com/course/intro-to-ios-app-development-with-swift--ud585?utm_medium=referral&utm_campaign=api,intermediate,"In this course we will build an iPhone app that records a conversation between you and a friend, and then makes your voices sound like a Chipmunk or Darth Vader.

This course will introduce you to iOS app development in Swift, a new programming language from Apple, and serves as your launching point into the [iOS Developer Nanodegree](https://www.udacity.com/course/nd003).","This course assumes prior programming experience. Specifically, you should have a strong understanding of programming concepts like variables, if statements, loops, functions, and classes. Lesson 1 of [Intro to Computer Science](https://www.udacity.com/course/cs101) and [Programming Foundations with Python](https://www.udacity.com/course/ud036) are good courses to take if you are completely new to programming.

You will also need access to a Mac computer running OS X 10.10 or later.

We have designed this course such that you will not need a physical device (i.e. an iPhone or an iPad) to build your app. We will be using a simulator on your mac that will imitate the features of a phone on your computer. Towards the end of the course we will provide instructions on how to download your app on an iPhone (in case you do have access to a physical device.)",
cs046,Intro to Java Programming,https://www.udacity.com/course/intro-to-java-programming--cs046?utm_medium=referral&utm_campaign=api,beginner,"In this introductory course, you'll learn and practice essential computer science concepts using the Java programming language. You'll learn about Object Oriented Programming, a technique that allows you to use code written by other programmers in your own programs. You'll put your new Java programming skills to the test by solving real-world problems faced by software engineers.",No prior programming experience and knowledge is assumed or needed. Beginners welcome!,
ud197,Intro to Relational Databases,https://www.udacity.com/course/intro-to-relational-databases--ud197?utm_medium=referral&utm_campaign=api,intermediate,"This course is a quick, fun introduction to using a relational database from your code, using examples in Python. You'll learn the basics of SQL (the Structured Query Language) and database design, as well as the Python API for connecting Python code to a database. You'll also learn a bit about protecting your database-backed web apps from common security problems.

After taking this course, you'll be able to write code using a database as a backend to store application data reliably and safely.","**You can read and write basic code in Python.** This course uses programming exercises in Python. If you haven't worked with Python before, check out our course <a href=""https://www.udacity.com/course/ud036"" target=""_blank"">Programming Foundations with Python</a>.

If you can understand this code (maybe with the help of the <a href=""https://docs.python.org/2/library/random.html#random.choice"" target=""_blank"">**random** module documentation</a>), you know enough Python for this course:

<pre>
import random

def ChooseTwice(items):
    a = random.choice(items)
    b = random.choice(items)
    return a, b

names = [""Alice"", ""Bob"", ""Charlie"", ""Debra""]
(one, two) = ChooseTwice(names)
if one == two:
    print ""%s is happy!"" % one
else:
    print ""%s likes %s!"" % (one, two)
</pre>

**You can use a command-line interface (terminal).** Some of the exercises in this course involve using a Unix-style command-line interface to enter commands, run Python programs, and navigate directories.

If you have taken our course on <a href=""/course/ud775"" target=""_blank"">Git and Github</a>, the level of command-line use in this course is similar.

**You don't need to be a Web programmer.** This course does include a small Web application and some HTML and JavaScript in examples, but you will not need to make changes in these languages.

**You don't need any previous database experience.** This course is an entry-level introduction to relational databases.

**You need a programming text editor** (such as <a href=""http://www.sublimetext.com/"" target=""_blank"">Sublime Text</a>) installed on your computer. You should be able to use it to open and edit files of Python code.",
ud088,Full Stack Foundations,https://www.udacity.com/course/full-stack-foundations--ud088?utm_medium=referral&utm_campaign=api,intermediate,"In this course you will learn the fundamentals of back-end web development! You will create your own web application that queries a database for items on restaurant menus and then dynamically generates complete menus in the form of web pages and API endpoints.

You’ll start by learning how to interact with a database from a web application using an Object-Relational Mapping (ORM) layer. From there, you’ll learn how GET and POST requests translate to CRUD operations. You’ll then explore the Flask framework and the various ways in which it can speed up the development of your applications. Finally, you’ll develop your very own web application from the ground up using the iterative development process.","You should be comfortable with Python, including Object-Oriented Programming. If you’d like to brush up on your Python, try the first three lessons of our <a href=""/course/cs101"" target=""_blank"">Intro to Computer Science</a> course. For Object-Oriented Programming in Python, see <a href=""/course/ud036"" target=""_blank"">Programming Foundations with Python</a>.

You should also have a firm understanding of SQL and working with a relational database, particularly PostgreSQL. Our <a href=""/course/ud197"" target=""_blank"">Intro to Relational Databases</a> course can get you started if you feel you’re not yet prepared.

Finally, you should be able to read and write HTML and CSS without any guidance. If you need a refresher on HTML and CSS, start with our <a href=""/course/ud304"" target=""_blank"">Intro to HTML and CSS</a> course.

To complete the final project for this course, it is ***critical*** you meet these prerequisites as you are given no assets to begin with and will truly build a complete web application from scratch.",
ud330,Authentication & Authorization: OAuth,https://www.udacity.com/course/authentication-authorization-oauth--ud330?utm_medium=referral&utm_campaign=api,intermediate,"As a Python programmer, leveraging Flask allows you to quickly and easily build your own web applications. But before you share your apps on the Internet you should protect your users' data, ensuring information stored on your site is safe from unwanted manipulation. You could implement web security and permissions on your own, but relying on trusted providers is a faster, safer, and easier way to allow users to login to your application - without having to create and maintain another account, profile, and password. 

In this course, you will learn to implement the OAuth 2.0 framework to allow users to securely login to your web applications. You'll be provided a  <a href=""http://udacity-oauth.herokuapp.com"" target=""_blank"">restaurant menu application</a> created in Flask. By the end of this course, you will write the necessary code to implement Google+ Sign-In and Facebook Login in options so users can create restaurant menus that are viewable by everyone but only modifiable by the original creator.","This course was built to expand upon the concepts introduced in <a href=""https://www.udacity.com/course/ud088"" target=""_blank"">Full Stack Foundations</a>, specifically: 

* performing CRUD operations
* making use of templates
* developing with the Flask framework

Additionally, HTML, JavaScript, AJAX are heavily used in this course.  A basic understanding of these technologies is needed to get the most out of these lectures.

If you'd like to refresh your HTML knowledge start with our <a href=""https://www.udacity.com/course/ud304"" target=""_blank"">Intro to HTML and CSS</a> course. You can check out the <a href=""https://www.udacity.com/course/ud804"" target=""_blank"">JavaScript Basics</a> and <a href=""https://www.udacity.com/course/ud110"" target=""_blank"">Intro to AJAX</a> courses to brush up on these topics as well.",
ud893,Responsive Web Design Fundamentals,https://www.udacity.com/course/responsive-web-design-fundamentals--ud893?utm_medium=referral&utm_campaign=api,intermediate,"In this course you'll learn the fundamentals of responsive web design with Google's Pete LePage! You'll create your own responsive web page that works well on any device - phone, tablet, desktop or anything in between.

You’ll start by exploring what makes a site responsive and how some common responsive design patterns work across different devices.  From there, you’ll learn how to create your own responsive layout using the viewport tag and CSS media queries.  As you proceed, you’ll experiment with major and minor breakpoints, and optimizing text for reading.","You should be comfortable reading and writing HTML and CSS. You should also be able to inspect and modify websites using browser developer tools (we use <a href=""http://www.google.com/chrome/"" target=""_blank"">Google Chrome</a>, but you should be able to accomplish all the tasks in this course with any browser's developer tools).


If you are unfamiliar with HTML and CSS, or if feel like you need to brush up on them, start with our <a href=""https://www.udacity.com/ud304"" target=""_blank"">Intro to HTML and CSS</a>.


You will not need to write JavaScript for this course.",
ud882,Responsive Images,https://www.udacity.com/course/responsive-images--ud882?utm_medium=referral&utm_campaign=api,intermediate,"Did you know that images account for more than **60%** of the bytes on average needed to load a web page?

In this course you will learn how to work with images on the modern web, so that your images look great and load quickly on any device.

Along the way, you will pick up a range of skills and techniques to smoothly integrate responsive images into your development workflow. By the end of the course, you will be developing with images that adapt and respond to different viewport sizes and usage scenarios.","You should be comfortable working with simple HTML, CSS and JavaScript. Experience with image creation and processing tools will also help.",
ud860,Browser Rendering Optimization,https://www.udacity.com/course/browser-rendering-optimization--ud860?utm_medium=referral&utm_campaign=api,advanced,"<a href=""https://twitter.com/hashtag/PERFMATTERS?src=hash"" target=""_blank"">Performance matters</a> to users. Web developers need to build apps that react quickly and render smoothly.

Google performance guru Paul Lewis is here to help you destroy <a href=""http://jankfree.org/"" target=""_blank"">jank</a> and create web apps that maintain 60 frames per second performance.

You'll leave this course with the tools you need to profile apps and identify the causes of jank. You'll explore the browser's rendering pipeline and uncover patterns that make it easy to build performant apps.","* You're a web developer who has written apps using HTML, CSS and JavaScript.
* You have used <a href=""https://developer.chrome.com/devtools"" target=""_blank"">Chrome DevTools</a>.
* (Recommended) Background knowledge about the critical rendering path from <a href=""https://www.udacity.com/course/ud884"" target=""_blank"">Website Performance Optimization</a> will be helpful.",
