key,name,course_link,level,summary,required_knowledge,
ud858,Developing Scalable Apps in Python,https://www.udacity.com/course/developing-scalable-apps-in-python--ud858?utm_medium=referral&utm_campaign=api,advanced,"You will learn about challenges of building applications that can serve hundreds of thousands of users, and how you can prepare for them as a developer. And more importantly - you will learn how to harness the power of **App Engine** - Platform as a Service, run by Google, so you can focus on your application's features, not on managing infrastructure that runs your app. Let Google run and scale the infrastructure and do what you do best - write code! 

However, to use App Engine effectively, you have to learn how it works, and this is exactly what this course will teach! You will also learn the best practices of using <a href=""https://cloud.google.com/products/cloud-endpoints/"" target=""_blank"">Cloud Endpoints</a> that allow you to easily create API services and make them accessible to iOS, Android and Javascript clients. They allow you to automatically generate client libraries to make wiring up the frontend easy. And there are some nifty built-in features, like denial-of-service protection and OAuth 2.0 support.","You should be fairly comfortable programming in Python, preferably with some experience developing web applications and working with databases for at least a year. You will be developing the backend of a sample app, so you don’t have to worry about HTML or JavaScript.

You should have sufficient permissions to install new software on your computer, and comfortable configuring it, including setting up system variables.

We will be using Maven and Eclipse for this course, and we strongly suggest that you use them as well.",
ud989,JavaScript Design Patterns,https://www.udacity.com/course/javascript-design-patterns--ud989?utm_medium=referral&utm_campaign=api,advanced,"This course covers methods for organizing your code, both conceptually and literally. You’ll learn the importance of separating concerns when writing JavaScript, gaining hands-on experience along the way. Separating concerns can be done with or without an organizational library or framework. We’ll learn how to separate concerns without one, and then we’ll explore an organizational library together. You’ll also learn strategies for exploring other libraries and frameworks on your own.

By the end of this course, you’ll understand (from experience) the importance of code organization, and how to implement it with either vanilla JavaScript or an organizational library or framework. Your applications will start looking clean and professional—not just to your users, but also to anyone who looks at the code driving your applications.","This course is for intermediate web developers with some experience with JavaScript, and some prior experience with a JavaScript library, such as jQuery.

Students should also be proficient in HTML and CSS, and should have experience creating static pages.",
ud990,Learn Backbone.js,https://www.udacity.com/course/learn-backbonejs--ud990?utm_medium=referral&utm_campaign=api,advanced,"This course is a collection of resources designed to introduce you to Backbone, a common organizational library for front-end web applications.

By the end of this course, you’ll know how to write well organized web applications using the Backbone framework. You’ll also make use of the Local Storage API or a service like Firebase to support persistent data storage across user sessions.","This course is intended to build on the knowledge and programming concepts taught in <a href=""https://www.udacity.com/course/javascript-design-patterns--ud989"" target=""_blank"">Javascript Design Patterns</a>, is for web developers with JavaScript experience, and some prior experience with a JavaScript library, such as jQuery.

Students should also be proficient in HTML and CSS, and should have experience creating static pages.",
ud549,JavaScript Testing,https://www.udacity.com/course/javascript-testing--ud549?utm_medium=referral&utm_campaign=api,intermediate,"In this course you'll learn how to write JavaScript applications with confidence, using the red-green-refactor workflow. You'll write comprehensive suites of tests that validate your application is functioning as intended at all times.

You'll start by exploring how other industries use a variety of tests and the value it provides. You'll then start writing your very own tests, using the Jasmine testing framework. Finally, you'll start developing your very own address book application using the red-green-refactor workflow and explore a variety of scenarios including testing asynchronous functions.","You should be comfortable writing JavaScript and using its object-oriented programming features. If you need a refresher on these subjects, consider taking our <a href=""https://www.udacity.com/course/ud804"" target=""_blank"">JavaScript Basics</a> and <a href=""https://www.udacity.com/course/ud015"" target=""_blank"">Object-Oriented JavaScript</a> courses.",
ud299,Configuring Linux Web Servers,https://www.udacity.com/course/configuring-linux-web-servers--ud299?utm_medium=referral&utm_campaign=api,advanced,"In this course you'll learn the basic Linux fundamentals every web developer needs to know to share their web applications with the world! You'll get a basic Python WSGI application up and running within a Vagrant virtual machine that queries data from a PostgreSQL database.

You'll start by exploring various Linux distributions and learning the differences between a number of them. You'll then explore how the Linux operating system differs from other operating systems you may be more familiar with. With this base knowledge, you'll then move into Linux security - covering topics such as file permissions, user management, package management and configuring firewalls. Finally, you'll transform a safe and secure baseline server into a web application server by installing and configuring the Apache HTTP Server and PostgreSQL database server.","You should be comfortable with your terminal and working within a shell, if you need a refresher take a look at our Intro to the Shell.

To actually get a web application up and running you should be familiar with the Python programming language and PostgreSQL. <a href=""https://www.udacity.com/course/programming-foundations-with-python--ud036"" target=""_blank"">Programming Foundations with Python</a> and <a href=""https://www.udacity.com/course/intro-to-relational-databases--ud197"" target=""_blank"">Intro to Relational Databases</a> can help you get up to speed if you feel you need some additional practice.",
ep245,How to Build a Startup,https://www.udacity.com/course/how-to-build-a-startup--ep245?utm_medium=referral&utm_campaign=api,intermediate,"In an introduction to the basics of the famous Customer Development Process, Steve Blank provides insight into the key steps needed to build a successful startup. 

The main idea in this course is learning how to rapidly develop and test ideas by gathering massive amounts of customer and marketplace feedback. Many startups fail by not validating their ideas early on with real-life customers. In order to mitigate that, students will learn how to get out of the building and search for the real pain points and unmet needs of customers. Only with these can the entrepreneur find a proper solution and establish a suitable business model.

Building a startup is not simply building an execution plan for a business model that the entrepreneur thinks will work, but rather, a search for the actual business model itself.","This class involves no programming. The characteristics of a budding entrepreneur: passion, tenacity, and a willingness to work hard, are essential. 

We also recommend you join the class with at least a rough idea of a business model for a startup you would like to work on throughout this class.",
ud902,Learn Swift Programming Syntax,https://www.udacity.com/course/learn-swift-programming-syntax--ud902?utm_medium=referral&utm_campaign=api,intermediate,"Swift is a language created by Apple specifically for iOS and OS X development. It’s fast, concise, and comes with tools  which make it easier than ever to visualize one's code. 

This course focuses on the syntax of the Swift programming language. By the end of the course, students should be able to apply Swift essentials to building iOS apps and employ Swift's more unique elements, like optional types and switch statements, with confidence.","**This course assumes prior programming experience!** Specifically, you should be familiar with programming concepts like variables, if statements, and loops, as well as object-oriented concepts like methods and classes.

You will also need access to a Mac computer running OS X 10.10 or later.",
ud788,UIKit Fundamentals,https://www.udacity.com/course/uikit-fundamentals--ud788?utm_medium=referral&utm_campaign=api,intermediate,"In this course, you will build a series of simple apps to become more comfortable with the UIKit framework and master its most widely used components. This framework constitutes the building blocks of the user interface for all iOS apps, and is crucial for any iOS Developer to be intimately familiar with.","**This course assumes prior iOS experience.** Specifically, it assumes that you have built at least one single-view app, and can use Xcode to modify swift files and storyboard scenes. You should know what a View Controller is, and know how to create outlets and actions. You should also have basic familiarity of the <a href=""https://www.udacity.com/course/learn-swift-programming-syntax--ud902"" target=""_blank"">Swift programming language</a>.

The course also assumes basic familiarity with Git. Specifically, you will need to be able to clone git repositories and checkout branches specific to each lesson.  

You will need access to a Mac computer running OS X 10.10 or later. However, you do not need an iPad or iPhone to complete the activities. All exercises can be completed using the iOS simulator built into Xcode.",
ud421,iOS Networking with Swift,https://www.udacity.com/course/ios-networking-with-swift--ud421?utm_medium=referral&utm_campaign=api,advanced,"In this course, you’ll learn how to incorporate networking into your apps, so they can access data from around the world. You’ll learn how to harness the power of APIs to display images and retrieve movie data. At the end of the course, you’ll build the “On the Map” app which allows you to share interesting links, projects, or other information with fellow Udacity students.","**This course assumes prior iOS experience.** Specifically, you’ve built several apps, know how to use core iOS libraries, and are familiar with MVC design principles. <a href=""https://www.udacity.com/course/ud585"" target=""_blank"">Introduction to iOS App Development with Swift</a> and <a href=""https://www.udacity.com/course/ud788"" target=""_blank"">UIKit Fundamentals</a> are good courses to take if you need to familiarize yourself with these concepts. 

The course also assumes basic familiarity with Git. Specifically, you will need to be able to clone Git repositories and checkout branches specific to each lesson. <a href=""https://www.udacity.com/course/ud775"" target=""_blank"">How to Use Git & GitHub</a> is a great option if you need to brush up on these skills.

You will need access to a Mac computer running OS X 10.9 or later. However, you do not need an iPad or iPhone to complete the activities. All exercises can be completed using the iOS simulator built into Xcode.",
ud325,iOS Persistence and Core Data,https://www.udacity.com/course/ios-persistence-and-core-data--ud325?utm_medium=referral&utm_campaign=api,advanced,"Persisting data is a core skill for any iOS developer. This course will teach you two techniques for storing data to your device’s hard drive: the NSKeyedArchiver method and the more complex, but robust Core Data.","This course assumes extensive iOS experience. Specifically, you’ve built several apps, know how to use core iOS libraries, and are familiar with networking and MVC design principles. <a href=""https://www.udacity.com/course/ud585"" target=""_blank"">Introduction to iOS App Development with Swift</a>, <a href=""https://www.udacity.com/course/ud788"" target=""_blank"">UIKit Fundamentals</a>, and <a href=""https://www.udacity.com/course/ud421"" target=""_blank"">iOS Networking with Swift</a> are good courses to take if you need to familiarize yourself with these concepts. 

The course also assumes basic familiarity with git. Specifically, you will need to be able to clone git repositories and checkout branches specific to each lesson. <a href=""https://www.udacity.com/course/ud775"" target=""_blank"">How to Use Git & GitHub</a> is a great option if you need to brush up on these skills.

You will need access to a Mac computer running OS X 10.9 or later. However, you do not need an iPad or iPhone to complete the activities. All exercises can be completed using the iOS simulator built into Xcode.",
ud774,Xcode Debugging,https://www.udacity.com/course/xcode-debugging--ud774?utm_medium=referral&utm_campaign=api,advanced,"""If debugging is the process of removing bugs, then programming must be the process of putting them in.""<br> 
*Edsger W. Dijkstra*

Debugging is yin to programming's yang; you can't have one without the other. However, finding bugs in programs can be an incredibly frustrating and demotivating process for developers. This course will teach you a variety of techniques to help make debugging your code easier.","This course assumes rudimentary iOS programming experience. You should be able to scan Swift code to identify methods and errors, and make minor changes to correct them.",
ud607,How to Make an iOS App,https://www.udacity.com/course/how-to-make-an-ios-app--ud607?utm_medium=referral&utm_campaign=api,advanced,"Do you have some experience building apps for the iPhone or iPad and want to build an app from the ground up, but don't know where to begin? Look no further! In this course, you'll learn the process of building an iOS app, from brainstorming ideas to publishing on the App Store.","**Enrolling in this course assumes you have prior iOS development experience.** The material won't cover the technical aspects of app development, instead serving as a guide through the process of building an app. Specifically, the course was built to support the final project in the <a href=""https://www.udacity.com/course/ios-developer-nanodegree--nd003"" target=""_blank"">iOS Developer Nanodegree</a> and assumes mastery of the concepts taught in the following courses:

* <a href=""https://www.udacity.com/course/uikit-fundamentals--ud788"" target=""_blank"">UIKit Fundamentals</a>
* <a href=""https://www.udacity.com/course/ios-networking-with-swift--ud421"" target=""_blank"">iOS Networking with Swift</a>
* <a href=""https://www.udacity.com/course/ios-persistence-and-core-data--ud325"" target=""_blank"">iOS Persistence and Core Data</a> 

Please also note that submitting to the App Store, or loading your app to a physical device requires enrollment in the <a href=""https://developer.apple.com/programs/ios/"" target=""_blank"">iOS Developer Program</a>.",
ud257,A/B Testing,https://www.udacity.com/course/ab-testing--ud257?utm_medium=referral&utm_campaign=api,intermediate,"This course will cover the design and analysis of A/B tests, also known as split tests, which are online experiments used to test potential improvements to a website or mobile application. Two versions of the website are shown to different users - usually the existing website and a potential change. Then, the results are analyzed to determine whether the change is an improvement worth launching. This course will cover how to choose and characterize metrics to evaluate your experiments, how to design an experiment with enough statistical power, how to analyze the results and draw valid conclusions, and how to ensure that the the participants of your experiments are adequately protected.","This course requires introductory knowledge of descriptive and inferential statistics. If you haven't learned these topics, or need a refresher, they are covered in the Udacity courses <a href=""https://www.udacity.com/course/ud201"" target=""_blank"">Inferential Statistics</a> and <a href=""https://www.udacity.com/course/ud827"" target=""_blank"">Descriptive Statistics</a>.

Prior experience with A/B testing is not required, and neither is programming knowledge.",
ud507,Data Visualization and D3.js,https://www.udacity.com/course/data-visualization-and-d3js--ud507?utm_medium=referral&utm_campaign=api,intermediate,"Learn the fundamentals of data visualization and practice communicating with data. This course covers how to apply design principles, human perception, color theory, and effective storytelling to data visualization. If you present data to others, aspire to be an analyst or data scientist, or if you’d like to become more technical with visualization tools, then you can grow your skills with this course.

The course does not cover exploratory approaches to discover insights about data. Instead, the course focuses on how to visually encode and present data to an audience once an insight has been found.

This course is part of the <a href=""https://www.udacity.com/course/nd002"" target=""_blank"">Data Analyst Nanodegree</a>.","Regardless of your programming background, you can learn about data visualization and design principles in Lesson 1a and Lesson 2a without the following recommended background.

To succeed in this course, you should to be familiar with basic programming principles, including data types (strings, arrays, booleans, etc.), `if else` statements, and `for` loops. You should also be able to describe concepts like functions and objects. Our <a href=""https://www.udacity.com/course/cs101"" target=""_blank"">Intro to Computer Science</a> and <a href=""https://www.udacity.com/course/ud036"" target=""_blank"">Programming Fundamentals with Python</a> courses are great places to get started.

Basic knowledge of HTML and CSS (structuring and styling a web page) is not required but highly recommended. We suggest taking the <a href=""https://www.udacity.com/course/ud304"" target=""_blank"">Intro to HTML and CSS</a> course if you have no experience with HTML or CSS.

This course is unique in that the final project can be completed using either dimple.js or d3.js. The visualization library, dimple.js, is easier to use than d3.js and requires less background knowledge. Furthermore, a graphic can be created in considerably fewer lines of code using dimple.js as opposed to d3.js.

So why should you learn d3.js?

Data Driven Documents (d3.js) allows you to build highly customized graphics. If you would like to gain more technical skills and learn more about Javascript and open web standards, then you should complete Lesson 3 and Lesson 4 in order to prepare for the final project.


If you would like to complete the final project using d3.js, you should have some experience reading and using documentation. For example, you should be able to code a `for` loop in Javascript or be able to look up the syntax to work with strings and arrays in Javascript. We recommend taking the <a href=""https://www.udacity.com/course/ud804"" target=""_blank"">Javascript Basics</a> course if you have little to no experience with Javascript.",
ud120,Intro to Machine Learning,https://www.udacity.com/course/intro-to-machine-learning--ud120?utm_medium=referral&utm_campaign=api,intermediate,"Machine Learning is a first-class ticket to the most exciting careers in data analysis today. As data sources proliferate along with the computing power to process them, going straight to the data is one of the most straightforward ways to quickly gain insights and make predictions.  

Machine learning brings together computer science and statistics to harness that predictive power. It’s a must-have skill for all aspiring data analysts and data scientists, or anyone else who wants to wrestle all that raw data into refined trends and predictions.

This is a class that will teach you the end-to-end process of investigating data through a machine learning lens. It will teach you how to extract and identify useful features that best represent your data, a few of the most important machine learning algorithms, and how to evaluate the performance of your machine learning algorithms.

This course is also a part of our <a href=""https://www.udacity.com/course/nd002"">Data Analyst</a> Nanodegree.","To succeed in this course, you must be proficient at programming in Python and basic statistics. If you need a refresher on any of these topics, you can check out these courses:

- [Intro to Computer Science](https://www.udacity.com/course/cs101) (You should know basic data structures and control statements, and be able to write and import functions.)

- [Inferential Statistics](https://www.udacity.com/course/ud201)

- [Descriptive Statistics](https://www.udacity.com/course/ud827)


One additional course that would be nice to have is Intro to [Data Science](https://www.udacity.com/course/intro-to-data-science--ud359), as this will get you familiar with scientific problem-solving.  However, completion of that class isn't required for success.  We will also use a tiny bit of <a href=""https://www.udacity.com/course/ud775"">git</a>, which you can also learn about on Udacity.

One thing that we don’t require is previous exposure to machine learning.  If you’re a machine learning beginner, you’re in the right place.",
ud617,Intro to Hadoop and MapReduce,https://www.udacity.com/course/intro-to-hadoop-and-mapreduce--ud617?utm_medium=referral&utm_campaign=api,intermediate,"The Apache™ Hadoop® project develops open-source software for reliable, scalable, distributed computing. Learn the fundamental principles behind it, and how you can use its power to make sense of your Big Data.","Lesson 1 does not have technical prerequisites and is a good overview of Hadoop and MapReduce for managers.

To get the most out of the class, however, you need basic programming skills in Python on a level provided by introductory courses like our <a target=""_blank"" href=""https://www.udacity.com/course/cs101"">Introduction to Computer Science</a> course.

To learn more about Hadoop, you can also check out the book <a href=""http://www.amazon.com/gp/product/1449311520/ref=as_li_ss_tl?ie=UTF8&camp=1789&creative=390957&creativeASIN=1449311520&linkCode=as2&tag=udacity-20"" target=""_blank"">Hadoop: The Definitive Guide</a>.",
ud381,Real-Time Analytics with Apache Storm,https://www.udacity.com/course/real-time-analytics-with-apache-storm--ud381?utm_medium=referral&utm_campaign=api,intermediate,"The world is trending in real time!  Learn from Twitter to scalably process tweets, or any big data stream, in real-time to drive d3 visualizations using Apache Storm, the “Hadoop of Real Time.”  Storm is free, open source, and fun to use!  Learn from Karthik Ramasamy, Technical Lead of Storm@Twitter, about the distributed, fault-tolerant, and flexible technology used to power Twitter’s real-time data flow pipeline.  Twitter open sourced Storm in 2011, and it graduated to a top-level Apache project in September, 2014.  

Starting from basic distributed concepts presented during our first Udacity-Twitter Storm Hackathon, link Storm concepts to Storm syntax to scalably drive Word Cloud visualizations with Vagrant, Ubuntu, Maven, Flask, Redis, and d3.  Link to the public Twitter gardenhose stream to process live tweets, parse embedded URLs, and calculate Top worldwide hashtags.  Extend beyond Storm basics by exploring multi-language capabilities in Python, integrate open source components, and implement real-time streaming joins.

In your final project, follow real-time trending topics by implementing the data pipeline to visualize only tweets that contain Top worldwide hashtags.  Extend your project by exploring the Twitter API, or any data source, alongside Hackathon participants as they design their own ideas, receive feedback from Karthik, and open source a final project calculating real-time tweet sentiment and geolocation to drive a U.S. Map.","Programming language required: Java

To be successful, you'll need intermediate knowledge of Java. Specifically, this is defined by experience and comfort with Java syntax, compile & run-time error diagnostics and debugging, ability to use javadocs as needed, and intermediate data structures including Arrays, HashMaps, and LinkedLists.  If you need to build these skills, a good starting point is Udacity’s <a href=""https://www.udacity.com/course/cs046"">Introduction to Java</a> with additional comfortability needed identifying and debugging compile & run-time errors.

No prior experience is assumed in Ubuntu, git, Maven, Redis, Flask (Python) or d3 (Javascript).  Python is useful, but optional.  A basic course such as CS101 or OO in Python would be helpful.",
