key,name,course_link,level,summary,required_knowledge,
ud359,Intro to Data Science,https://www.udacity.com/course/intro-to-data-science--ud359?utm_medium=referral&utm_campaign=api,intermediate,"The Introduction to Data Science class will survey the foundational topics in data science, namely:

*   Data Manipulation
*   Data Analysis with Statistics and Machine Learning
*   Data Communication with Information Visualization
*   Data at Scale -- Working with Big Data  

The class will focus on breadth and present the topics briefly instead of focusing on a single topic in depth. This will give you the opportunity to sample and apply the basic techniques of data science.

This course is also a part of our <a href=""https://www.udacity.com/course/nd002"">Data Analyst</a> Nanodegree.","The ideal students for this class are prepared individuals who have:

*   Strong interest in data science
*   Background in intro level statistics
*   Python programming experience
*   Or understanding of programming concepts such as variables, functions, loops, and basic python data structures like lists and dictionaries

If you need to brush up on your programming, we highly recommend [Introduction to Computer Science: Building a Search Engine](https://www.udacity.com/course/cs101). If you need a refresher on statistics, enroll in [Intro to Descriptive Statistics](https://www.udacity.com/course/ud827) and [Intro to Inferential Statisitics](https://www.udacity.com/course/ud201). All three are on Udacity!",
cs253,Web Development,https://www.udacity.com/course/web-development--cs253?utm_medium=referral&utm_campaign=api,intermediate,"Try to picture yourself sitting down with your computer, ready to start developing a fully functional web application for the first time, available online for millions to use. “Where should I even begin? How long is this going to take me? Am I making any mistakes along the way?” The questions may leave you with an uneasy feeling that you will learn many lessons the hard way. 

In this intermediate course, Steve Huffman will teach you everything he wished he knew when he started building <a href=""http://www.reddit.com/"" target=""_blank"">Reddit</a> and, more recently, <a href=""http://www.hipmunk.com/"" target=""_blank"">Hipmunk</a>, as a lead engineer. Starting from the basics of how the web works, this course will walk you through core web development concepts such as how internet and browsers fit together, form validations, databases, APIs, integrating with other websites, scaling issues, and more; all of which form part of the knowledge it takes to build a web application of your own.","In order to take the full advantage of this course, we want you to be well prepared for it. This course assumes an intermediate proficiency programming with Python, as well as a solid knowledge on the following topics: 

- Basic computer science concepts such as procedures, decision statements, and loops. 
- Basic data structures such as lists, dictionaries, and hash tables. 
- Object-oriented programming. 

Please feel free to peek at the <a href=""https://www.udacity.com/course/cs101"" target=""_blank"">Intro to Computer Science</a> and <a href=""https://www.udacity.com/course/ud036"" target=""_blank"">Programming Foundations with Python</a> courses to make sure you are comfortable with these required concepts for the course.",
ud015,Object-Oriented JavaScript,https://www.udacity.com/course/object-oriented-javascript--ud015?utm_medium=referral&utm_campaign=api,intermediate,"Have you been dabbling with JavaScript but find your files keep turning into a mess of spaghetti code? Do you find yourself copying and pasting lines of code over and over throughout your application? Surely there’s a better way, right? 

Yes, there is a better way -- object-oriented programming will allow you to build websites using reusable blocks of code known as libraries, similar to using bricks to build a house. This course is designed to teach web developers how to utilize the various object-oriented programming features within JavaScript, and more importantly, how to write reusable and maintainable libraries that will make your life easier.","This course is for beginner to intermediate web developers with an understanding of JavaScript syntax. Specifically, you should know how to write control structures, how to write simple functions, and recognize the different variable types in JavaScript. As well as be able to read existing JavaScript code with these features and predict its outcome. If you need a refresher on these prerequisites, check out our <a href=""https://www.udacity.com/course/ud804"" target=""_blank"">JavaScript Basics</a> course!",
ud292,HTML5 Canvas,https://www.udacity.com/course/html5-canvas--ud292?utm_medium=referral&utm_campaign=api,beginner,"Canvas is an HTML5 element which gives you drawable surface inside your web pages you can control with JavaScript. Powerful enough to use for compositing images and even creating games.

In this course, through several sample projects, you’ll learn how to use the canvas; how to make compositions using shapes, images, and text; how to create effects and filters on images and how to create animations.","To succeed in this course, we expect you to have some HTML and JavaScript experience. You should at minimum understand loops, functions, and conditional statements(if/else). 

Udacity’s [JavaScript Basics course](https://www.udacity.com/course/ud804) and [HTML/CSS course](https://www.udacity.com/course/ud304) are good preparation for this course.",
ud245,Intro to jQuery,https://www.udacity.com/course/intro-to-jquery--ud245?utm_medium=referral&utm_campaign=api,intermediate,"jQuery is the most popular JavaScript library today, in use by over 60% of the top 100,000 most visited websites. This course will teach you how to use jQuery’s core features - DOM element selections, traversal and manipulation.

You'll also learn how to read and make sense of jQuery's documentation, making it easy for you to go beyond the methods taught in this class and take advantage of jQuery's full array of features!

This course is also a part of our <a href=""https://www.udacity.com/course/nd001"">Front-End Web Developer</a> Nanodegree.","To succeed in this course, we expect you to have some HTML and JavaScript experience. You should at minimum understand loops, functions, and conditional statements (if/else). 

Udacity’s [JavaScript Basics course](https://www.udacity.com/course/ud804) and [HTML/CSS course](https://www.udacity.com/course/ud304) are good preparation for this course.",
ud110,Intro to AJAX,https://www.udacity.com/course/intro-to-ajax--ud110?utm_medium=referral&utm_campaign=api,intermediate,"In this course you will learn how to make asynchronous requests with JavaScript (using jQuery’s AJAX functionality), and gain a better understanding of what’s actually happening when you do so. You will also learn how to use data APIs so you can take advantage of freely accessible data in your applications, including photo results, news articles and up-to-date data about the world around us.

As part of the course, you’ll be building a web app that will help people learn about a place where they want to move! Your app will query the Google Streetview, Wikipedia and New York Times APIs!

This course is also a part of our <a href=""https://www.udacity.com/course/nd001"">Front-End Web Developer</a> Nanodegree.","* Intermediate proficiency with JavaScript (equivalent to having finished JavaScript Basics).
* Familiarity with HTML/CSS.",
cs271,Intro to Artificial Intelligence,https://www.udacity.com/course/intro-to-artificial-intelligence--cs271?utm_medium=referral&utm_campaign=api,intermediate,"Artificial Intelligence (AI) is a field that has a long history but is still constantly and actively growing and changing. In this course, you’ll learn the basics of modern AI as well as some of the representative applications of AI. Along the way, we also hope to excite you about the numerous applications and huge possibilities in the field of AI, which continues to expand human capability beyond our imagination.","Some of the topics in Introduction to Artificial Intelligence will build on probability theory and linear algebra. You should have understanding of probability theory comparable to that covered in our <a href=""https://www.udacity.com/course/st101"">Intro to Statistics</a> course.",
ud651,Data Analysis with R,https://www.udacity.com/course/data-analysis-with-r--ud651?utm_medium=referral&utm_campaign=api,intermediate,"Exploratory data analysis is an approach for summarizing and visualizing the important characteristics of a data set. Promoted by [John Tukey](http://en.wikipedia.org/wiki/John_Tukey), exploratory data analysis focuses on exploring data to understand the data’s underlying structure and variables, to develop intuition about the data set, to consider how that data set came into existence, and to decide how it can be investigated with more formal statistical methods.

If you're interested in supplemental reading material for the course check out the <a href=""http://www.amazon.com/gp/product/0201076160/ref=as_li_ss_il?ie=UTF8&camp=1789&creative=390957&creativeASIN=0201076160&linkCode=as2&tag=udacity-20"">Exploratory Data Analysis</a> book. (Not Required)

This course is also a part of our <a href=""https://www.udacity.com/course/nd002"">Data Analyst</a> Nanodegree.","A background in statistics is helpful but not required. Consider taking [Intro to Descriptive Statistics](https://www.udacity.com/course/ud827) and [Intro to Inferential Statistics](https://www.udacity.com/course/ud201) prior to taking this course. Relevant topics include:  

*   Mean, median, mode
*   Normal, uniform, and skewed distributions
*   Histograms and box plots

<br />
Familiarity with the following CS and Math topics will help students:  

*   Variable assignment
*   Comparison and logical operators ( <, >, <=, >=, ==, &, | )
*   If else statements
*   Square roots, logarithms, and exponentials",
ud849,UX Design for Mobile Developers,https://www.udacity.com/course/ux-design-for-mobile-developers--ud849?utm_medium=referral&utm_campaign=api,beginner,"This course is optimized for the developer who is looking to efficiently learn the most important design techniques that will help them make better apps (with a focus on mobile/Android). 

This is a UX design course built for current (and aspiring) mobile developers. In this short course, you'll step back from your IDE and dive into the techniques that great designers use to plan and prototype amazing apps before any code is written.

####[Download Udacity's Android app](https://play.google.com/store/apps/details?id=com.udacity.android) to keep learning wherever you go!","This course is optimized for the developer who is looking to efficiently learn the most important design techniques that will help them make better apps (with a focus on mobile/Android).

That said, programming experience is not required to benefit from the design principles and best practices we teach in this course.",
ud162,Intro to Point & Click App Development,https://www.udacity.com/course/intro-to-point-click-app-development--ud162?utm_medium=referral&utm_campaign=api,beginner,"This class teaches you how to build powerful web and mobile apps and host them in the cloud, without writing a line of code.

By the end of this short course, you'll use the skills you've developed to conceptualize and create your own app. To get you there, your instructors Samantha and Andy will first help you build an app that could be used to manage logistics at a music festival. Though this is a very specific app use case, the skills you learn will be applicable to just about any business app you’d want to develop.","Good news! You don't need any programming experience and you don't need to know anything about Salesforce. You'll learn the ins and outs of point-and-click development, so all you need now is an interest in building an app.

One thing you should know: the skills you learn in this course are in high demand and will help further your career.",
ud859,Developing Scalable Apps in Java,https://www.udacity.com/course/developing-scalable-apps-in-java--ud859?utm_medium=referral&utm_campaign=api,advanced,"You will learn about challenges of building applications that can serve hundreds of thousands of users, and how you can prepare for them as a developer. And more importantly - you will learn how to harness the power of **App Engine** - Platform as a Service, run by Google, so you can focus on your application's features, not on managing infrastructure that runs your app. Let Google run and scale the infrastructure and do what you do best - write code! 

However, to use App Engine effectively, you have to learn how it works, and this is exactly what this course will teach! You will also learn the best practices of using <a href=""https://cloud.google.com/products/cloud-endpoints/"" target=""_blank"">Cloud Endpoints</a> that allow you to easily create RESTful services and make them accessible to iOS, Android and Javascript clients. They allow you to automatically generate client libraries to make wiring up the frontend easy. And there are some nifty built-in features, like denial-of-service protection and OAuth 2.0 support.","You should be fairly comfortable programming in Java, preferably with some experience developing web applications and working with databases for at least a year. You will be developing the backend of a sample app, so you don’t have to worry about HTML or JavaScript.

You should have sufficient permissions to install new software on your computer, and comfortable configuring it, including setting up system variables.

We will be using Maven and Eclipse for this course, and we strongly suggest that you use them as well.",
cs344,Intro to Parallel Programming,https://www.udacity.com/course/intro-to-parallel-programming--cs344?utm_medium=referral&utm_campaign=api,advanced,"Learn the fundamentals of parallel computing with the GPU and the CUDA programming environment! In this class, you'll learn about parallel programming by coding a series of image processing algorithms, such as you might find in Photoshop or Instagram. You'll be able to program and run your assignments on high-end GPUs, even if you don't own one yourself.  

**Why It’s Important to Think Parallel**  

[Third Pillar of Science][1]  
Learn how scientific discovery can be accelerated by combining theory and experimentation with computing to fight cancer, prevent heart attacks, and spur new advances in robotic surgery.

[1]: http://www.youtube.com/watch?v=3DbAB2ChDBw",We expect students to have a solid experience with the C programming language and basic knowledge of data structures and algorithms.,
ud827,Intro to Descriptive Statistics,https://www.udacity.com/course/intro-to-descriptive-statistics--ud827?utm_medium=referral&utm_campaign=api,beginner,"Statistics is an important field of math that is used to analyze, interpret, and predict outcomes from data. Descriptive statistics will teach you the basic concepts used to describe data. This is a great beginner course for those interested in Data Science, Economics, Psychology, Machine Learning, Sports analytics and just about any other field.",This course assumes understanding of basic algebra and arithmetic.,
ud201,Intro to Inferential Statistics,https://www.udacity.com/course/intro-to-inferential-statistics--ud201?utm_medium=referral&utm_campaign=api,beginner,"Inferential statistics allows us to draw conclusions from data that might not be immediately obvious. This course focuses on enhancing your ability to develop hypotheses and use common tests such as t-tests, ANOVA tests, and regression to validate your claims.","This course assumes basic understanding of Descriptive Statistics, specifically the following:

- calculating the mean and standard deviation of a data set
- central limit theorem
- interpreting probability and probability distributions
- normal distributions and sampling distributions
- normalizing observations

If you need a refresher, check out our [Descriptive Statistics course](https://www.udacity.com/course/ud827)! The course also utilizes Google Spreadsheets as a tool.",
ud189,Advanced Operating Systems,https://www.udacity.com/course/advanced-operating-systems--ud189?utm_medium=referral&utm_campaign=api,advanced,"In this course, we will see all the advances that have led to the state-of-the-art operating system that we know today, covering variety of platforms -- cell phones, multi-core, parallel systems, distributed systems, and cloud computing.","Students are expected to have taken an undergraduate OS course, or have some experience in industry. A good understanding of the concepts in a standard textbook such as ""Operating Systems Concepts,"" Silberschatz and Galvin (or its equivalent) will be assumed in this course. 

Students must also be comfortable with UNIX and C programming.",
ud061,"Computability, Complexity & Algorithms",https://www.udacity.com/course/computability-complexity-algorithms--ud061?utm_medium=referral&utm_campaign=api,advanced,"<i>This class is offered as CS6505 at Georgia Tech where it is a part of the [Online Masters Degree (OMS)](http://www.omscs.gatech.edu/). Taking this course here will not earn credit towards the OMS degree.</i>

In this course, we will ask the big questions, “What is a computer? What are the limits of computation? Are there problems that no computer will ever solve? Are there problems that can’t be solved quickly? What kinds of problems can we solve efficiently and how do we go about developing these algorithms?” Understanding the power and limitations of algorithms helps us develop the tools to make real-world computers smarter, faster and safer.","Students are expected to have a solid grasp of the basics of discrete mathematics.  Discrete Mathematics and Its Applications by Ken Rosen provides an excellent background for this course. 

If you answer “no” to any of the following questions, it may be beneficial to acquire background knowledge concurrently or prior to taking the course.

1. Can you show that the sum of the first n numbers is n(n+1)/2? Can you give the proof as an induction on n?
2. Can you give an O(n log n) algorithm for sorting n numbers?
3. Can you describe the difference between breadth-first and depth-first search?
4. Given an nxn matrix A and an n-dimensional vector b, can you give a polynomial-time algorithm to find a vector x such that Ax=b?",
ud409,Knowledge-Based AI: Cognitive Systems,https://www.udacity.com/course/knowledge-based-ai-cognitive-systems--ud409?utm_medium=referral&utm_campaign=api,advanced,"<i>This class is offered as CS7637 at Georgia Tech where it is a part of the [Online Masters Degree (OMS)](http://www.omscs.gatech.edu/). Taking this course here will not earn credit towards the OMS degree.</i>

This is a core course in artificial intelligence. It is designed to be a challenging course, involving significant independent work, readings, assignments, and projects. It covers structured knowledge representations, as well as knowledge-based methods of problem solving, planning, decision-making, and learning.

The class is organized around three primary learning goals. First, this class teaches the concepts, methods, and prominent issues in knowledge-based artificial intelligence. Second, it teaches the specific skills and abilities needed to apply those concepts to the design of knowledge-based AI agents. Third, it teaches the relationship between knowledge-based artificial intelligence and the study of human cognition.","A good course on computer programming such as CS 1332 or Udacity’s CS 101 is beneficial for students. An introductory course on Artificial Intelligence, such as Georgia Tech's CS 3600 or CS 6601, is recommended but not required.

To succeed in this course, you should be able to answer 'Yes' to the following four questions:
     
1. Are you comfortable with computer programming?
2. Are you familiar with concepts of data structures and object-oriented programming, such as inheritance and polymorphism?
3. Are you familiar with concepts of algorithms, such as sorting and searching algorithms?
4. Are you confident with either Java or Python?",
ud007,High Performance Computer Architecture,https://www.udacity.com/course/high-performance-computer-architecture--ud007?utm_medium=referral&utm_campaign=api,advanced,"<i>This class is offered as CS6290 at Georgia Tech where it is a part of the [Online Masters Degree (OMS)](http://www.omscs.gatech.edu/). Taking this course here will not earn credit towards the OMS degree.</i>

The course begins with a lesson on performance measurement, which leads to a discussion on the necessity of performance improvement.

Pipelining, the first level of performance refinement, is reviewed. The weaknesses of pipelining will be exposed and explored, and various solutions to these issues will be studied. The student will learn hardware, software, and compiler based solutions to these issues.","You must be familiar with Assembly code, the C or C++ programming language, Unix or Linux, and the basics of pipelining.",
ud809,Health Informatics in the Cloud,https://www.udacity.com/course/health-informatics-in-the-cloud--ud809?utm_medium=referral&utm_campaign=api,beginner,"<i>This class is offered as CS6440 at Georgia Tech where it is a part of the [Online Masters Degree (OMS)](http://www.omscs.gatech.edu/). Taking this course here will not earn credit towards the OMS degree.</i>

This is a survey course designed to provide a broad, forward-facing overview of contemporary health informatics, a specialized field of computing that seeks to improve the quality and efficiency of healthcare delivery. To understand health informatics (HIT) you also need to have at least a basic understanding of the complex and highly regulated US healthcare industry. The course is designed for students from diverse backgrounds and who have not been previously exposed to HIT. It is divided into three sections:

The US healthcare delivery and the key role of the federal government in promoting HIT adoption

The core technologies that drive all contemporary HIT systems and tools

The real world applications of HIT from electronic medical and personal health records to exploiting digital data aggregated from them for research and other purposes","The course is self-contained so there are no academic prerequisites. A knowledge of web programming (e.g. Java, Javascript, C++, C#) is required by at least some members of each team to do the team project.",
ud436,Computer Networking,https://www.udacity.com/course/computer-networking--ud436?utm_medium=referral&utm_campaign=api,intermediate,"<i>This class is offered as CS6250 at Georgia Tech where it is a part of the [Online Masters Degree (OMS)](http://www.omscs.gatech.edu/). Taking this course here will not earn credit towards the OMS degree.</i>

This course covers advanced topics in Computer Networking such as Software-Defined Networking (SDN), Data Center Networking and Content Distribution. The course is divided into three parts:

Part 1 is about the implementation, design principles and goals of a Computer Network and touches upon the various routing algorithms used in CN (such as link-state and distance vector). 

Part 2 talks about resource control and content distribution in Networking Applications. It covers Congestion Control and Traffic Shaping.

Part 3 deals with the operations and management of computer networks encompassing SDN's (Software Defined Networks), Traffic Engineering and Network Security.","The ideal preparation for this course would be the successful completion of an undergraduate level Computer Networking course. An understanding of the TCP/IP protocol and the its layer model is recommended. Basic knowledge of python (such as through <a href= ""https://www.udacity.com/course/cs101"">Intro to Computer Science</a>) is required.

You should be comfortable with the implementation of basic search algorithms and a working knowledge of Linux and virtual machines is recommended.",
ud805,Software Development Process,https://www.udacity.com/course/software-development-process--ud805?utm_medium=referral&utm_campaign=api,intermediate,"<i>This class is offered as CS6300 at Georgia Tech where it is a part of the [Online Masters Degree (OMS)](http://www.omscs.gatech.edu/). Taking this course here will not earn credit towards the OMS degree.</i>

In SDP, you will learn how to select and implement the ideal software process for your development project. Through Professor Orso's engaging examples and interviews with industry insiders, you will learn both conceptual and practical aspects of software engineering. The course covers requirements engineering, architecture and design, testing and maintenance, and software quality in general. 

The goal of this class is to equip you with the skills necessary to define requirements, set up an integrated development environment (IDE), learn Git (and Github!) and use Unified Modeling Language (UML) to design and build an Android application. We will also examine several testing practices and refactoring techniques that are helpful before the launch of your software project. 

While everyone working with software should have these skills, they are particularly important for Software Engineers and Engineering Managers.",A strong familiarity with Android development (perhaps through [Developing Android Apps](https://www.udacity.com/course/ud853)) is expected.,
